ABB_DIST_NAME,STAT,LAST_UPDATE,JXTN_STAT,Jurisdiction Last Updated,STATE,COUNTY,JXTN,PARENT_JXTN,DIST_NAME,BYLAW_EFF,CHANGE_EXP,DIST_MAP,EXT_DIST,OVER,DIST_TYPE,Most Common Nonresidential Use Permitted,AFF_DIST,ELD_DIST,Internal Notes,Visible Atlas Notes,1FDP,1-Family Min. Lot Size,1-Family Min. Lot Size Units,1F_FSET,1F_FSET_UNITS,1F_SSET,1F_SSET_UNITS,1F_RSET,1F_RSET_UNITS,1-Family Max Lot Coverage - Buildings,1-Family Max Lot Coverage - Buildings Units,1-Family Max Lot Coverage - Buildings & Impervious Surface,1-Family Max Lot Coverage - Buildings & Impervious Surface Units,1-Family Min. Parking,1-Family Min. Parking Units,1-Family Max Stories,1-Family Max Stories Units,1-Family Max Height,1-Family Max Height Units,1F_FTA,1F_FTA_UNITS,1F_MIN_UNIT,1F_MIN_UNIT_UNITS,2FDP,2-Family Affordable Only,2-Family Elderly Only,2-Family Min Lot Size,2-Family Min Lot Size Units,2-Family Max Density,2-Family Max Density Units,2F_FSET,2F_FSET_UNITS,2F_SSET,2F_SSET_UNITS,2F_RSET,2F_RSET_UNITS,2-Family Max Lot Coverage Buildings,2-Family Max Lot Coverage Buildings Units,2-Family Max Lot Coverage Buildings & Impervious,2-Family Max Lot Coverage Buildings & Impervious Units,2-Family Min Parking Per Studio/1BR,2-Family Min Parking Per Studio/1BR Units,2-Family Min Parking Per 2+ BR,2-Family Min Parking Per 2+ BR Units,2-Family Max Stories,2-Family Max Stories Units,2-Family Max Height,2-Family Max Height Units,2F_FTA,2F_FTA_UNITS,2-Family Min Unit Size,2-Family Min Unit Size Units,3FDP,3-Family Affordable Only,3-Family Elderly Only,3-Family Min Lot Size,3-Family Min Lot Size Units,3-Family Max Density,3-Family Max Density Units,3F_FSET,3F_FSET_UNITS,3F_SSET,3F_SSET_UNITS,3F_RSET,3F_RSET_UNITS,3-Family Max Lot Coverage Buildings,3-Family Max Lot Coverage Buildings Units,3-Family Max Lot Coverage Buildings & Impervious,3-Family Max Lot Coverage Buildings & Impervious Units,3-Family Min Parking Per Studio/1BR,3-Family Min Parking Per Studio/1BR Units,3-Family Min Parking Per 2+ BR,3-Family Min Parking Per 2+ BR Units,3-Family Sewer/Water Required,3-Family Public Transit Required,3-Family Max Stories,3-Family Max Stories Units,3-Family Max Height,3-Family Max Height Units,3F_FTA,3F_FTA_UNITS,3-Family Min Unit Size,3-Family Min Unit Size Units,3-Family Max Bedrooms,3-Family Max Bedrooms Units,4FDP,4+-Family Affordable Only,4+-Family Elderly Only,4+-Family Min Lot Size,4+-Family Min Lot Size Units,4+-Family Max Density,4+-Family Max Density Units,4F_FSET,4F_FSET_UNITS,4F_SSET,4F_SSET_UNITS,4F_RSET,4F_RSET_UNITS,4+-Family Max Lot Coverage Buildings,4+-Family Max Lot Coverage Buildings Units,4+-Family Max Lot Coverage Buildings & Impervious,4+-Family Max Lot Coverage Buildings & Impervious Units,4+-Family Min Parking Per Studio/1BR,4+-Family Min Parking Per Studio/1BR Units,4+-Family Min Parking Per 2+ BR,4+-Family Min Parking Per 2+ BR Units,4+-Family Sewer/Water Required,4+-Family Public Transit Required,4+-Family Max Stories,4+-Family Max Stories Units,4+-Family Max Height,4+-Family Max Height Units,4F_FTA,4F_FTA_UNITS,4+-Family Min Unit Size,4+-Family Min Unit Size Units,4+-Family Max Bedrooms,4+-Family Max Bedrooms Units,4+-Family Max Units per Building,4+-Family Max Units per Building Units,Affordable Housing Treatment,Affordable Housing Definition,Affordable Elderly Only,Affordable Min Lot Size,Affordable Min Lot Size Units,Affordable Max Density,Affordable Max Density Units,Affordable Min Parking Per Studio/1BR,Affordable Min Parking Per Studio/1BR Units,Affordable Min Parking Per 2+ BR,Affordable Min Parking Per 2+ BR Units,Affordable Sewer/Water Required,Affordable Public Transit Required,Affordable Min Unit Size,Affordable Min Unit Size Units,Affordable Max Bedrooms,Affordable Max Bedrooms Units,Affordable Max Units per Building,Affordable Max Units per Building Units,ADU Treatment,ADU Employee/Family Required,ADU Renter Prohibited,ADU_OWNER_REQD,ADU Elderly Only,ADU Min Lot Size,ADU Min Lot Size Units,ADU Min Parking,ADU Min Parking Units,ADU Only Primary Structure,ADU Max Size (% of Main),ADU Max Size (% of Main) Units,ADU Max Size (sq ft),ADU Max Size (sq ft) Units,ADU Max Bedrooms,ADU Max Bedrooms Units,PRD Treatment,PRD Mobile or Manufactured,PRD Min Development Size,PRD Min Development Size Units,PRD Max Density,PRD Max Density Units,PRD Max Units,PRD Max Units Units,5F_AFF,5F_ELD,5F_MIN_LOT,5F_MAX_DENS,5F_FSET,5F_SSET,5F_RSET,5F_MAX_LOT_BLDG,5F_MAX_LOT_IMP,5F_PARK_1BR,5F_PARK_2BR,5F_CNXN_H2O,5F_CNXN_TRANSIT,5F_STORIES,5F_FEET,5F_FTA,5F_MIN_UNIT,5F_BEDROOMS,5F_MAX_UNITS,BASE_DENS,1F_FRONT,2F_FRONT,3F_FRONT,4F_FRONT,5F_FRONT,PUD_SUBDV,PUD_THRESH,PUD_ALLOW,PUD_CONSERVE,GIS_ID
Ecological Reserve,Completed,2024-05-30,Published,2024-05-31,Vermont,Washington County,Duxbury,,Ecological Reserve Lands,2024-05-28,,Yes,No,No,Nonresidential,Open Space/Light Recreation,No,No,,,Prohibited,,,,,,,,,,,,,,,,,,,,,,,Prohibited,No,No,,,,,,,,,,,,,,,,,,,,,,,,,,,Prohibited,No,No,,,,,,,,,,,,,,,,,,,No,No,,,,,,,,,,,Prohibited,No,No,,,,,,,,,,,,,,,,,,,No,No,,,,,,,,,,,,,Prohibited,,No,,,,,,,,,No,No,,,,,,,Prohibited,No,No,No,No,,,,,No,,,,,,,Prohibited,No,,,,,,,,,,,,,,,,,,,,,,,,,,,,,,,,,,f,,
FHO,Completed,2024-05-30,Published,2024-05-31,Vermont,Washington County,Duxbury,,Flood Hazard Overlay District,2024-05-28,,No,No,Yes,Mixed with Residential,Open Space/Light Recreation,No,No,,"New residential developments of any kind are not permitted within the floodway. ADUs equal or less than 500 square feet may be conditionally permitted within the floodway (public hearing), and ADUs are permitted outside the floodway. Outside the floodway residential development is permitted conditionally (with public hearing).",Public Hearing,,,,,,,,,,,,,,,,,,,,,,,Public Hearing,No,No,,,,,,,,,,,,,,,,,,,,,,,,,,,Public Hearing,No,No,,,,,,,,,,,,,,,,,,,No,No,,,,,,,,,,,Public Hearing,No,No,,,,,,,,,,,,,,,,,,,No,No,,,,,,,,,,,,,Not Mentioned,,No,,,,,,,,,No,No,,,,,,,Allowed/Conditional,No,No,No,No,,,1.0,Parking Spaces Add'l to Main Unit,Yes,30.0,Percent of Main Unit,Permitted within floodway if =<500sqft,Contextual,,,Public Hearing,No,,,,,,,,,,,,,,,,,,,,,,,,,,,,,,,,f,,t,f,
Forest Mgmt.,Completed,2024-05-30,Published,2024-05-31,Vermont,Washington County,Duxbury,,Forest Management and Wildlife Lands,2024-05-28,,Yes,No,No,Mixed with Residential,Open Space/Light Recreation,No,No,,"""For proposed development that is of an integrated, unified design, the DRB may approve lots as small as one-fourth acre, provided that doing so furthers the purpose of this section and Article II, Section 6.10 (B).""",Allowed/Conditional,25,Acres,50,Feet,40,Feet,40,Feet,,,,,1.0,Spaces per Unit,2.5,Stories,36.0,Feet,,,,,Prohibited,No,No,,,,,,,,,,,,,,,,,,,,,,,,,,,Prohibited,No,No,,,,,,,,,,,,,,,,,,,No,No,,,,,,,,,,,Prohibited,No,No,,,,,,,,,,,,,,,,,,,No,No,,,,,,,,,,,,,Not Mentioned,,No,,,,,,,,,No,No,,,,,,,Allowed/Conditional,No,No,No,No,,,1.0,Parking Spaces Add'l to Main Unit,Yes,30.0,Percent of Main Unit,,,,,Public Hearing,No,,,,,,,,,,,,,,,,,,,,,,,,,,1.0,150.0,,,,,f,,t,f,
Forest Rec.,Completed,2024-05-30,Published,2024-05-31,Vermont,Washington County,Duxbury,,Forest-Residential-Recreation,2024-05-28,,Yes,No,No,Mixed with Residential,Open Space/Light Recreation,No,No,,,Allowed/Conditional,5,Acres,50,Feet,40,Feet,40,Feet,,,,,1.0,Spaces per Unit,2.5,Stories,36.0,Feet,,,,,Prohibited,No,No,,,,,,,,,,,,,,,,,,,,,,,,,,,Prohibited,No,No,,,,,,,,,,,,,,,,,,,No,No,,,,,,,,,,,Prohibited,No,No,,,,,,,,,,,,,,,,,,,No,No,,,,,,,,,,,,,Not Mentioned,,No,,,,,,,,,No,No,,,,,,,Allowed/Conditional,No,No,No,No,,,1.0,Parking Spaces Add'l to Main Unit,Yes,30.0,Percent of Main Unit,,,,,Public Hearing,No,,,,,,,,,,,,,,,,,,,,,,,,,,1.0,150.0,,,,,f,,t,f,
Rural Ag II Residential,Completed,2024-05-30,Published,2024-05-31,Vermont,Washington County,Duxbury,,Rural-Residential-Agricultural II,2024-05-28,,Yes,No,No,Primarily Residential,,No,No,"""All residences in Duxbury are served by individual subsurface wastewater disposal Facilities, which must conform to the health regulations established in the Zoning Ordinance."" (Town Plan: https://www.duxburyvermont.org/town-government/zoning)

""A maximum density of one unit per acre will be permitted for residential development; however, all multi-home developments should include provisions for open space, and PUDs are especially encouraged and may be conditionally permitted."" (Town Plan: https://www.duxburyvermont.org/town-government/zoning)",Frontage for all dwelling types: 100ft in general; 200ft along Route 100,Allowed/Conditional,1,Acres,50ft from center of town roads; 100ft from center of Route 100,Contextual,20,Feet,20,Feet,,,35.0,Percent,1.0,Spaces per Unit,2.5,Stories,36.0,Feet,,,,,Allowed/Conditional,No,No,1.0,Acres per 2-Family,1.0,Units per Acre,50ft from center of town roads; 100ft from center of Route 100,Contextual,20.0,Feet,20.0,Feet,,,35.0,Percent,1.0,Spaces per Unit,1.0,Spaces per Unit,2.5,Stories,36.0,Feet,,,,,Public Hearing,No,No,1.0,Acres per 3-Family,1.0,Units per Acre,50ft from center of town roads; 100ft from center of Route 100,Contextual,20.0,Feet,20.0,Feet,,,35.0,Percent,1.0,Spaces per Unit,1.0,Spaces per Unit,Yes,No,2.5,Stories,36.0,Feet,,,,,,,Public Hearing,No,No,1.0,Acres per 4+-Family,1.0,Units per Acre,50ft from center of town roads; 100ft from center of Route 100,Contextual,20.0,Feet,20.0,Feet,,,35.0,Percent,1.0,Spaces per Unit,1.0,Spaces per Unit,Yes,No,2.5,Stories,36.0,Feet,,,,,,,,,Not Mentioned,,No,,,,,,,,,No,No,,,,,,,Allowed/Conditional,No,No,No,No,,,1.0,Parking Spaces Add'l to Main Unit,Yes,30.0,Percent of Main Unit,,,,,Public Hearing,Yes,,,,,,,f,f,1.0,1.0,,20.0,20.0,,35.0,1.0,1.0,t,f,2.5,36.0,,,,,1.0,,,,,,f,,t,f,
Rural Ag I Residential,Completed,2024-05-30,Published,2024-05-31,Vermont,Washington County,Duxbury,,Rural-Residential-Agricultural I,2024-05-28,,Yes,No,No,Primarily Residential,,No,No,"""All residences in Duxbury are served by individual subsurface wastewater disposal Facilities, which must conform to the health regulations established in the Zoning Ordinance."" (Town Plan: https://www.duxburyvermont.org/town-government/zoning)

""A maximum density of one unit per acre will be permitted for residential development; however, all multi-home developments should include provisions for open space, and PUDs are especially encouraged and may be conditionally permitted."" (Town Plan: https://www.duxburyvermont.org/town-government/zoning)",Frontage for all dwelling types: 100ft in general; 200ft along Route 100,Allowed/Conditional,1,Acres,50ft from center of town roads; 100ft from center of Route 100,Contextual,20,Feet,20,Feet,,,35.0,Percent,1.0,Spaces per Unit,2.5,Stories,36.0,Feet,,,,,Allowed/Conditional,No,No,1.0,Acres per 2-Family,1.0,Units per Acre,50ft from center of town roads; 100ft from center of Route 100,Contextual,20.0,Feet,20.0,Feet,,,35.0,Percent,1.0,Spaces per Unit,1.0,Spaces per Unit,2.5,Stories,36.0,Feet,,,,,Public Hearing,No,No,1.0,Acres per 3-Family,1.0,Units per Acre,50ft from center of town roads; 100ft from center of Route 100,Contextual,20.0,Feet,20.0,Feet,,,35.0,Percent,1.0,Spaces per Unit,1.0,Spaces per Unit,Yes,No,2.5,Stories,36.0,Feet,,,,,,,Public Hearing,No,No,1.0,Acres per 4+-Family,1.0,Units per Acre,50ft from center of town roads; 100ft from center of Route 100,Contextual,20.0,Feet,20.0,Feet,,,35.0,Percent,1.0,Spaces per Unit,1.0,Spaces per Unit,Yes,No,2.5,Stories,36.0,Feet,,,,,,,,,Not Mentioned,,No,,,,,,,,,No,No,,,,,,,Allowed/Conditional,No,No,No,No,,,1.0,Parking Spaces Add'l to Main Unit,Yes,30.0,Percent of Main Unit,,,,,Public Hearing,Yes,,,,,,,f,f,1.0,1.0,,20.0,20.0,,35.0,1.0,1.0,t,f,2.5,36.0,,,,,1.0,,,,,,f,,t,f,
State Farm,Completed,2024-05-30,Published,2024-05-31,Vermont,Washington County,Duxbury,,State Farm District,2024-05-28,,Yes,No,No,Mixed with Residential,Agricultural-Industrial,No,No,,"New residential developments are only permitted within the Crossett Hill and Cemetery sub-areas. In both, single-family dwellings are permitted but only as part of a PUD.
Frontage: Crossett Hill: 100ft; Cemetery50ft",Allowed/Conditional,Crossett Hill: 2 acres; Cemetery: 1 acre,Contextual,Crossett Hill: 50ft; Cemetery: 40ft,Contextual,"Crossett Hill: 20ft; Cemetery: 25ft, 50ft (Old Rte 100), 200ft (Rte 100)",Contextual,"Crossett Hill: 20ft; Cemetery: 25ft, 50ft (Old Rte 100), 200ft (Rte 100)",Contextual,,,,,1.0,Spaces per Unit,2.5,Stories,36.0,Feet,,,,,Prohibited,No,No,,,,,,,,,,,,,,,,,,,,,,,,,,,Prohibited,No,No,,,,,,,,,,,,,,,,,,,No,No,,,,,,,,,,,Prohibited,No,No,,,,,,,,,,,,,,,,,,,No,No,,,,,,,,,,,,,Not Mentioned,,No,,,,,,,,,No,No,,,,,,,Allowed/Conditional,No,No,No,No,,,1.0,Parking Spaces Add'l to Main Unit,Yes,30.0,Percent of Main Unit,,,,,Public Hearing,No,,,,,,,,,,,,,,,,,,,,,,,,,,1.0,,,,,,f,,t,t,
Village,Completed,2024-05-30,Published,2024-05-31,Vermont,Washington County,Duxbury,,Village,2024-05-28,,Yes,No,No,Mixed with Residential,Retail/Service,No,No,"""All residences in Duxbury are served by individual subsurface wastewater disposal Facilities, which must conform to the health regulations established in the Zoning Ordinance."" (Town Plan: https://www.duxburyvermont.org/town-government/zoning)

""A maximum density of one unit per acre will be permitted for residential development; however, all multi-home developments should include provisions for open space, and PUDs are especially encouraged and may be conditionally permitted."" (Town Plan: https://www.duxburyvermont.org/town-government/zoning)","Frontage for all dwellings: ""50 feet or 20 feet right-of-way"" (Duxbury Land Use Regulations, page 9)",Allowed/Conditional,0.5,Acres,40,Feet,10,Feet,10,Feet,,,,,1.0,Spaces per Unit,2.5,Stories,36.0,Feet,,,,,Allowed/Conditional,No,No,0.5,Acres per 2-Family,1.0,Units per Acre,40,Feet,10.0,Feet,10.0,Feet,,,,,1.0,Spaces per Unit,1.0,Spaces per Unit,2.5,Stories,36.0,Feet,,,,,Public Hearing,No,No,0.5,Acres per 3-Family,1.0,Units per Acre,40,Feet,10.0,Feet,10.0,Feet,,,,,1.0,Spaces per Unit,1.0,Spaces per Unit,Yes,No,2.5,Stories,36.0,Feet,,,,,,,Public Hearing,No,No,0.5,Acres per 4+-Family,1.0,Units per Acre,40,Feet,10.0,Feet,10.0,Feet,,,,,1.0,Spaces per Unit,1.0,Spaces per Unit,Yes,No,2.5,Stories,36.0,Feet,,,,,,,,,Not Mentioned,,No,,,,,,,,,No,No,,,,,,,Allowed/Conditional,No,No,No,No,,,1.0,Parking Spaces Add'l to Main Unit,Yes,30.0,Percent of Main Unit,,,,,Public Hearing,Yes,,,,,,,f,f,0.5,1.0,40.0,10.0,10.0,,,1.0,1.0,t,f,2.5,36.0,,,,,1.0,,,,,,f,,t,f,
