Status,Last Updated,Jurisdiction Status,Jurisdiction Last Updated,State,County,Jurisdiction,Parent Jurisdiction,Abbreviated District Name,Full District Name,Effective Start Date,Changed or Expired,District Mapped,District Mapped But Extinct,Overlay,Type of Zoning District,Most Common Nonresidential Use Permitted,Affordable Housing District,Elderly Housing District,Internal Notes,Visible Atlas Notes,1-Family Treatment,1-Family Min. Lot Size,1-Family Min. Lot Size Units,1-Family Front Setback,1-Family Front Setback Units,1-Family Side Setback,1-Family Side Setback Units,1-Family Rear Setback,1-Family Rear Setback Units,1-Family Max Lot Coverage - Buildings,1-Family Max Lot Coverage - Buildings Units,1-Family Max Lot Coverage - Buildings & Impervious Surface,1-Family Max Lot Coverage - Buildings & Impervious Surface Units,1-Family Min. Parking,1-Family Min. Parking Units,1-Family Max Stories,1-Family Max Stories Units,1-Family Max Height,1-Family Max Height Units,1-Family Floor to Area Ratio,1-Family Floor to Area Ratio Units,1-Family Min. Unit Size,1-Family Min. Unit Size Units,2-Family Treatment,2-Family Affordable Only,2-Family Elderly Only,2-Family Min Lot Size,2-Family Min Lot Size Units,2-Family Max Density,2-Family Max Density Units,2-Family Front Setback,2-Family Front Setback Units,2-Family Side Setback,2-Family Side Setback Units,2-Family Rear Setback,2-Family Rear Setback Units,2-Family Max Lot Coverage Buildings,2-Family Max Lot Coverage Buildings Units,2-Family Max Lot Coverage Buildings & Impervious,2-Family Max Lot Coverage Buildings & Impervious Units,2-Family Min Parking Per Studio/1BR,2-Family Min Parking Per Studio/1BR Units,2-Family Min Parking Per 2+ BR,2-Family Min Parking Per 2+ BR Units,2-Family Max Stories,2-Family Max Stories Units,2-Family Max Height,2-Family Max Height Units,2-Family Floor to Area Ratio,2-Family Floor to Area Ratio Units,2-Family Min Unit Size,2-Family Min Unit Size Units,3-Family Treatment,3-Family Affordable Only,3-Family Elderly Only,3-Family Min Lot Size,3-Family Min Lot Size Units,3-Family Max Density,3-Family Max Density Units,3-Family Front Setback,3-Family Front Setback Units,3-Family Side Setback,3-Family Side Setback Units,3-Family Rear Setback,3-Family Rear Setback Units,3-Family Max Lot Coverage Buildings,3-Family Max Lot Coverage Buildings Units,3-Family Max Lot Coverage Buildings & Impervious,3-Family Max Lot Coverage Buildings & Impervious Units,3-Family Min Parking Per Studio/1BR,3-Family Min Parking Per Studio/1BR Units,3-Family Min Parking Per 2+ BR,3-Family Min Parking Per 2+ BR Units,3-Family Sewer/Water Required,3-Family Public Transit Required,3-Family Max Stories,3-Family Max Stories Units,3-Family Max Height,3-Family Max Height Units,3-Family Floor to Area Ratio,3-Family Floor to Area Ratio Units,3-Family Min Unit Size,3-Family Min Unit Size Units,3-Family Max Bedrooms,3-Family Max Bedrooms Units,4+-Family Treatment,4+-Family Affordable Only,4+-Family Elderly Only,4+-Family Min Lot Size,4+-Family Min Lot Size Units,4+-Family Max Density,4+-Family Max Density Units,4+-Family Front Setback,4+-Family Front Setback Units,4+-Family Side Setback,4+-Family Side Setback Units,4+-Family Rear Setback,4+-Family Rear Setback Units,4+-Family Max Lot Coverage Buildings,4+-Family Max Lot Coverage Buildings Units,4+-Family Max Lot Coverage Buildings & Impervious,4+-Family Max Lot Coverage Buildings & Impervious Units,4+-Family Min Parking Per Studio/1BR,4+-Family Min Parking Per Studio/1BR Units,4+-Family Min Parking Per 2+ BR,4+-Family Min Parking Per 2+ BR Units,4+-Family Sewer/Water Required,4+-Family Public Transit Required,4+-Family Max Stories,4+-Family Max Stories Units,4+-Family Max Height,4+-Family Max Height Units,4+-Family Floor to Area Ratio,4+-Family Floor to Area Ratio Units,4+-Family Min Unit Size,4+-Family Min Unit Size Units,4+-Family Max Bedrooms,4+-Family Max Bedrooms Units,4+-Family Max Units per Building,4+-Family Max Units per Building Units,Affordable Housing Treatment,Affordable Housing Definition,Affordable Elderly Only,Affordable Min Lot Size,Affordable Min Lot Size Units,Affordable Max Density,Affordable Max Density Units,Affordable Min Parking Per Studio/1BR,Affordable Min Parking Per Studio/1BR Units,Affordable Min Parking Per 2+ BR,Affordable Min Parking Per 2+ BR Units,Affordable Sewer/Water Required,Affordable Public Transit Required,Affordable Min Unit Size,Affordable Min Unit Size Units,Affordable Max Bedrooms,Affordable Max Bedrooms Units,Affordable Max Units per Building,Affordable Max Units per Building Units,ADU Treatment,ADU Employee/Family Required,ADU Renter Prohibited,ADU Owner Occupancy Required,ADU Elderly Only,ADU Min Lot Size,ADU Min Lot Size Units,ADU Min Parking,ADU Min Parking Units,ADU Only Primary Structure,ADU Max Size (% of Main),ADU Max Size (% of Main) Units,ADU Max Size (sq ft),ADU Max Size (sq ft) Units,ADU Max Bedrooms,ADU Max Bedrooms Units,PRD Treatment,PRD Mobile or Manufactured,PRD Min Development Size,PRD Min Development Size Units,PRD Max Density,PRD Max Density Units,PRD Max Units,PRD Max Units Units,5+Family Affordable Housing Only,5+Family Elderly Housing Only,5+Family Min. Lot (ACRES),5+Family Max. Density (UNITS/ACRE),5+Family Front Setback (# of feet),5+Family Side Setback (# of feet),5+Family Rear Setback (# of feet),5+Family Max. Lot Coverage - Buildings (%),5+Family Max. Lot Coverage - Buildings & Imperviou,5+Family Min. # Parking Spaces Per Studio or 1BR,5+Family Min. # Parking Spaces Per 2+ BR,5+Family Connection to Sewer and/or Water Required,5+Family Connection or Proximity to Public Transit,5+Family Max. Height (# of stories),5+Family Max. Height (# of feet),5+Family Floor to Area Ratio,5+Family Min. Unit Size (SF),5+Family Max. # Bedrooms Per Unit,5+Family Max. # Units Per Building,Base Residential Density (#dwellings/acre),1-Family Lot Frontage Requirement,2-Family Lot Frontage Requirement,3-Family Lot Frontage Requirement,4-Family Lot Frontage Requirement,5+-Family Lot Frontage Requirement,PUD required with Subdivision,PUD Threshold #,PUD allowed,PUD requiring land conservation,Unique GIS schema identifier
Completed,2024-06-13,Published,2024-06-14,Vermont,Orange County,Brookfield,,A/R,Agricultural/Residential,2024-06-05,,Yes,No,No,Mixed with Residential,Agricultural-Industrial,No,No,,"PRD allowed with public hearing, but must be used for farming/forestry activities. Details in Section 2.1.E.3.
Minimum lot requirements do not include areas with a slope of >= 25% or class 1 and 2 wetlands. ",Allowed/Conditional,5.0,Acres,"65'; 50'/natural ponds; 75'/wetlands, streams + rivers",Alternatives,"50'; 75'/wetlands, streams + rivers",Alternatives,"50'; 75'/wetlands, streams + rivers",Alternatives,,,,,2.0,Spaces per Unit,,,,,,,,,Allowed/Conditional,No,No,5.0,Acres per 2-Family,,,"65'; 50'/natural ponds; 75'/wetlands, streams + rivers",Alternatives,"50'; 75'/wetlands, streams + rivers",Alternatives,"50'; 75'/wetlands, streams + rivers",Alternatives,,,,,2.0,Spaces per Unit,2.0,Spaces per Unit,,,,,,,,,Prohibited,No,No,,,,,,,,,,,,,,,,,,,No,No,,,,,,,,,,,Prohibited,No,No,,,,,,,,,,,,,,,,,,,No,No,,,,,,,,,,,,,Public Hearing,,No,5.0,Acres per Development,,,2.0,Spaces per Unit,2.0,Spaces per Unit,No,No,,,,,,,Allowed/Conditional,No,No,Yes,No,5.0,Acres,2.0,Parking Spaces Add'l to Main Unit,No,30.0,Percent of Main Unit,,,1.0,Bedrooms per Unit,Public Hearing,No,,,,,,,,,,,,,,,,,,,,,,,,,,,300.0,300.0,,,,,,,,
Completed,2024-06-13,Published,2024-06-14,Vermont,Orange County,Brookfield,,CON,Conservation,2024-06-05,,Yes,No,No,Mixed with Residential,Open Space/Light Recreation,No,No,,One family dwelling only allowed in Steep Slope Conservation Areas. ,Public Hearing,25.0,Acres,"65'; 75'/streams, wetlands, ponds + rivers",Alternatives,"50'; 75'/streams, wetlands, ponds + rivers",Alternatives,"50'; 75'/streams, wetlands, ponds + rivers",Alternatives,,,,,2.0,Spaces per Unit,,,,,,,,,Prohibited,No,No,,,,,,,,,,,,,,,,,,,,,,,,,,,Prohibited,No,No,,,,,,,,,,,,,,,,,,,No,No,,,,,,,,,,,Prohibited,No,No,,,,,,,,,,,,,,,,,,,No,No,,,,,,,,,,,,,Not Mentioned,,No,,,,,,,,,No,No,,,,,,,Allowed/Conditional,No,No,Yes,No,25.0,Acres,2.0,Parking Spaces Add'l to Main Unit,No,30.0,Percent of Main Unit,,,1.0,Bedrooms per Unit,Not Mentioned,No,,,,,,,,,,,,,,,,,,,,,,,,,,,20.0,,,,,,,,,
Completed,2024-06-13,Published,2024-06-14,Vermont,Orange County,Brookfield,,FHO,Flood Hazard,2024-06-05,,Yes,No,Yes,Overlay not Affecting Use,,No,No,,"Overlay makes all new building construction conditional (with public hearing). Development in the floodway areas is prohibited unless proven to not affect base flood levels by an engineer. Residential and commercial development in special flood hazard areas must be elevated to or above the base flood elevation; all development in special flood hazard areas must be anchored to prevent movement during flooding, constructed with materials resistant to flood damage and with methods that minimize damage, and heating/electricity/plumbing/etc. located so as to prevent water from entering during flooding.",Overlay,,,,,,,,,,,,,,,,,,,,,,,Overlay,No,No,,,,,,,,,,,,,,,,,,,,,,,,,,,Overlay,No,No,,,,,,,,,,,,,,,,,,,No,No,,,,,,,,,,,Overlay,No,No,,,,,,,,,,,,,,,,,,,No,No,,,,,,,,,,,,,Not Mentioned,,No,,,,,,,,,No,No,,,,,,,Not Mentioned,No,No,No,No,,,,,No,,,,,,,Not Mentioned,No,,,,,,,,,,,,,,,,,,,,,,,,,,,,,,,,,,,,
Completed,2024-06-13,Published,2024-06-14,Vermont,Orange County,Brookfield,,PL,Public Lands,2024-06-05,,Yes,No,No,Nonresidential,Open Space/Light Recreation,No,No,,Public parks and recreation - specific permitted and conditional uses in Section 2.1.D.,Prohibited,,,,,,,,,,,,,,,,,,,,,,,Prohibited,No,No,,,,,,,,,,,,,,,,,,,,,,,,,,,Prohibited,No,No,,,,,,,,,,,,,,,,,,,No,No,,,,,,,,,,,Prohibited,No,No,,,,,,,,,,,,,,,,,,,No,No,,,,,,,,,,,,,Not Mentioned,,No,,,,,,,,,No,No,,,,,,,Prohibited,No,No,No,No,,,,,No,,,,,,,Not Mentioned,No,,,,,,,,,,,,,,,,,,,,,,,,,,,,,,,,,,,,
Completed,2024-06-13,Published,2024-06-14,Vermont,Orange County,Brookfield,,SLO,Shoreland,2024-06-05,,Yes,No,Yes,Mixed with Residential,Open Space/Light Recreation,No,No,,"Area around Sunset Lake zoned as general development, areas around Baker, Lamson, North and Rood Ponds classified as recreational. 
Overlay allows 1-family treatment in underlying districts that also permit this with specified setbacks; 2-family treatment under this overlay requires a public hearing.
Required erosion protection measured can be found in the Shoreland Bylaws document Article VI.",Overlay,,,50'; 75'/recreational ponds; 25'/general dev. pond; 65'/public highway,Alternatives,50'; 75'/recreational ponds; 25'/general dev. pond; 65'/public highway,Alternatives,50'; 75'/recreational ponds; 25'/general dev. pond; 65'/public highway,Alternatives,,,,,,,,,,,,,,,Overlay,No,No,,,,,50'; 75'/recreational ponds; 25'/general dev. pond; 65'/public highway,Alternatives,50'; 75'/recreational ponds; 25'/general dev. pond; 65'/public highway,Alternatives,50'; 75'/recreational ponds; 25'/general dev. pond; 65'/public highway,Alternatives,,,,,,,,,,,,,,,,,Prohibited,No,No,,,,,,,,,,,,,,,,,,,No,No,,,,,,,,,,,Prohibited,No,No,,,,,,,,,,,,,,,,,,,No,No,,,,,,,,,,,,,Not Mentioned,,No,,,,,,,,,No,No,,,,,,,Not Mentioned,No,No,No,No,,,,,No,,,,,,,Not Mentioned,No,,,,,,,,,,,,,,,,,,,,,,,,,,,,,,,,,,,,
Completed,2024-06-13,Published,2024-06-14,Vermont,Orange County,Brookfield,,SP,Scenic Protection,2024-06-05,,Yes,No,Yes,Mixed with Residential,Open Space/Light Recreation,No,No,,Overlay allows 1-family treatment with public hearing in base districts that also permit 1-family treatment. ,Overlay,25.0,Acres,200,Feet,"50'; 75'/wetlands, ponds, streams + rivers",Alternatives,"50'; 75'/wetlands, ponds, streams + rivers",Alternatives,,,,,2.0,Spaces per Unit,,,,,,,,,Prohibited,No,No,,,,,,,,,,,,,,,,,,,,,,,,,,,Prohibited,No,No,,,,,,,,,,,,,,,,,,,No,No,,,,,,,,,,,Prohibited,No,No,,,,,,,,,,,,,,,,,,,No,No,,,,,,,,,,,,,Not Mentioned,,No,,,,,,,,,No,No,,,,,,,Allowed/Conditional,No,No,Yes,No,25.0,Acres,2.0,Parking Spaces Add'l to Main Unit,No,30.0,Percent of Main Unit,,,1.0,Bedrooms per Unit,Not Mentioned,No,,,,,,,,,,,,,,,,,,,,,,,,,,,20.0,,,,,,,,,
In Progress,2024-06-12,Published,2024-06-14,Vermont,Orange County,Brookfield,,VIL,Village,2024-06-05,,Yes,No,No,Mixed with Residential,Cultural/Entertainment/Tourist,No,No,,,Allowed/Conditional,,Acres,,Feet,,Feet,,Feet,,Percent,,Percent,,Spaces per Unit,,Stories,,Feet,,Ratio,,Square Feet,Allowed/Conditional,No,No,,Acres per 2-Family,,Units per Acre,,Feet,,Feet,,Feet,,Percent,,Percent,,Spaces per Unit,,Spaces per Unit,,Stories,,Feet,,Ratio,,Square Feet,Public Hearing,No,No,,Acres per 3-Family,,Units per Acre,,Feet,,Feet,,Feet,,Percent,,Percent,,Spaces per Unit,,Spaces per Unit,No,No,,Stories,,Feet,,Ratio,,Square Feet,,Bedrooms per Unit,Public Hearing,No,No,,Acres per 4+-Family,,Units per Acre,,Feet,,Feet,,Feet,,Percent,,Percent,,Spaces per Unit,,Spaces per Unit,No,No,,Stories,,Feet,,Ratio,,Square Feet,,Bedrooms per Unit,,Units per Building,,,No,,Acres per Development,,Units per Acre,,Spaces per Unit,,Spaces per Unit,No,No,,Square Feet,,Bedrooms per Unit,,Units per Building,Allowed/Conditional,No,No,Yes,No,,Acres,2.0,Parking Spaces Add'l to Main Unit,No,30.0,Percent of Main Unit,,,1.0,Bedrooms per Unit,,No,,Acres per PRD,,Units per Acre,,Units per PRD,,,,,,,,,,,,,,,,,,,,,,,,,,,,,,
